{"artifacts":[{"domain":"news","item_count":9,"path":"feed-news-bb34788f6cb6963201a2a66b009c08ca.json","sha256":"c20f54c50407509d1c5e63a6d947233d256af67fd6c43d9520faa53b4378f1f2","size_bytes":15496},{"domain":"macro_release","item_count":0,"path":"feed-macro_release-bb34788f6cb6963201a2a66b009c08ca.json","sha256":"167727bd2be5a4e512ceb600caa1bdc715c61afdcd204c5e5740785adb71d3c7","size_bytes":126},{"domain":"policy","item_count":7,"path":"feed-policy-bb34788f6cb6963201a2a66b009c08ca.json","sha256":"b9c328a443985d5eae3c6c2f69206402c85bd1e10f5d4c0f1de63122189f6e7c","size_bytes":6703},{"domain":"positioning","item_count":370,"path":"feed-positioning-bb34788f6cb6963201a2a66b009c08ca.json","sha256":"8ee009fd5aaee679eb78bf121ed3dc29486bbc54d4d3242cccf9ad25591d1004","size_bytes":644219},{"domain":"filing","item_count":8,"path":"feed-filing-bb34788f6cb6963201a2a66b009c08ca.json","sha256":"eea38c9ac8cba155e8a29d5a1c57d1de671ae05c845abc86a618a5fc73f116fe","size_bytes":326270}],"bundle_schemas":{"artifact":{"path":"schemas/feed-artifact.schema.json","sha256":"13939953e4d73f6a27d4c3a11230a5f5f6aca93ab49fd2d80a9973924b09a20e"},"manifest":{"path":"schemas/feed-manifest.schema.json","sha256":"e033b8b778f7cbfd30d0629adce4205029df3496770f523609fa623826c4efac"}},"collection_completed_at":"2026-10-13T06:55:41.669Z","collection_started_at":"2026-10-13T06:53:36.327Z","content_digest":"fb53ad86f8154361635383a010a1b7fa62ee70f6d4221015ea4e4dade6d171de","evidence_cutoff_at":"2026-10-13T06:53:36.327Z","feed_config":{"hash":"cee16ef3dc7d27c55f2b4859d280999cc3140d51cd0172151788d2a0c3aa6623","snapshot":{"coverage":[{"capability":"policy_and_news","group":"us_official_macro_policy","members":["federal_reserve","bls"],"minimum":2,"optional":false},{"capability":"watched_company_filings","group":"us_company_filings","members":["sec_edgar"],"minimum":1,"optional":false},{"capability":"policy_and_macro_release","group":"china_official_macro_policy","members":["pboc","nbs"],"minimum":2,"optional":false},{"capability":"news","group":"china_exchange_evidence","members":["sse","szse"],"minimum":2,"optional":false},{"capability":"positioning","group":"cftc_positioning","members":["cftc"],"minimum":1,"optional":false}],"feed":{"bootstrap_lookback_hours":72,"commit_reserve_seconds":15,"gap_threshold_hours":72,"global_concurrency":8,"http_attempt_timeout_seconds":20,"lock_timeout_seconds":60,"max_attempts":3,"max_decompressed_response_bytes":10485760,"max_items_per_provider":2000,"max_serialized_feed_bytes":52428800,"max_snippet_code_points":1000,"max_title_code_points":300,"max_url_characters":2048,"per_host_concurrency":2,"pre_commit_deadline_seconds":720,"sec_request_network_headroom_seconds":45,"source_content_request_network_headroom_seconds":120},"name":"follow-the-money","watched_beneficial_ownership_filers":[{"cik":"0001067983","name":"Berkshire Hathaway"}],"watched_companies":[{"cik":"0000949509","name":"Oaktree Capital Management","tickers":[]},{"cik":"0001061768","name":"Baupost Group","tickers":[]},{"cik":"0001067983","name":"Berkshire Hathaway","tickers":["BRK.A","BRK.B"]},{"cik":"0001135730","name":"Coatue Management","tickers":[]},{"cik":"0001167483","name":"Tiger Global Management","tickers":[]},{"cik":"0001336528","name":"Pershing Square Capital","tickers":[]},{"cik":"0001649339","name":"Scion Asset Management","tickers":[]},{"cik":"0001697748","name":"ARK Investment Management","tickers":[]}],"watched_form4_issuers":[{"cik":"0001067983","name":"Berkshire Hathaway"}]}},"feed_schema":{"path":"schemas/feed.schema.json","sha256":"4748452fb3e5da354617e5066f7cb5c3addc9bd0967eb129f59774c7c15d21df"},"generated_at":"2026-10-13T06:55:43.802Z","git":null,"pipeline":{"coverage_gap":{"uncovered_end":"2026-10-10T06:53:36.327Z","uncovered_start":"2026-09-21T05:07:25.054Z"},"status":"degraded","warnings":["blocked Provider exempted: provider_id=bls availability=blocked reason=HTTP 403 from www.bls.gov affected_coverage_groups=us_official_macro_policy","coverage gap: 2026-09-21T05:07:25.054Z to 2026-10-10T06:53:36.327Z"]},"producer":{"files":[{"path":"pyproject.toml","sha256":"7dc947aa6d902630074010dd1bfc3d0124f5b94b70491190cab142e94826f1f4","size":1008},{"path":"scripts/__init__.py","sha256":"e5f955bf6a4dbf21db9da00fb5eefe8593e106afd4281aff939ec225496790e1","size":55},{"path":"scripts/feed/follow-the-money-feed","sha256":"373e79ec2a1f244406007b27ef70c9c0fe887e01911d5a90cf0ba2950a8605b2","size":509},{"path":"scripts/quality_gate.py","sha256":"5e1b3c18c1cf91f52055d8b035baf47af0a3f60d5fc794ab8526e346cca08a23","size":1147},{"path":"scripts/skill/prepare-feed","sha256":"4f1e20450b105bacbe1d759fedb7bc7b1a96a1eb113bfa6e809a4a27d07add0f","size":427},{"path":"scripts/validate_generated_state.py","sha256":"d184596b00366b091b5ce953b1bcc6e281fbfedd8afee80287bc618166fea656","size":3912},{"path":"scripts/validate_workflows.py","sha256":"6e5bf836d61253b42f1d845470d2c8482116d3a41637502def86d70fdcf71c03","size":8411},{"path":"src/follow_the_money/__init__.py","sha256":"3568c0247534f2c20d62eb49542b6eb53f5bf15d8328c1aa6cb2878c3527468d","size":367},{"path":"src/follow_the_money/boundary.py","sha256":"1490e16510fd5f393171da8e72304b1c50045d7e94d6a95fd9d2d67b92d13f4c","size":2562},{"path":"src/follow_the_money/canonical.py","sha256":"93776e6146d82990b4cfe5e46371823a5dd69fecd27eb13fe05594a5d18ddeb0","size":2902},{"path":"src/follow_the_money/config/__init__.py","sha256":"b740d06fa9769b41506f24f579d924a8f6330e5ff4187a40bc596af427e8bce9","size":960},{"path":"src/follow_the_money/config/load.py","sha256":"e803ceede4d6539ce48094f972bb467eb5aa169313367b6894f3616ef30ab48b","size":22904},{"path":"src/follow_the_money/config/model.py","sha256":"a49261843ccb38abd4cb0b24e31dde365ce57e365c95035da21943b9c0f4cfa4","size":6422},{"path":"src/follow_the_money/digest.py","sha256":"d1eb48ae1c96c42e2d8e5408ced9fccbcf9b5c25fa7f7fa23b07032cd7b677ae","size":52693},{"path":"src/follow_the_money/feed/__init__.py","sha256":"cd46b5c5e99217b69fa7390cff6be356bea7fb57f61ce4a90e90a4bb2d5885b4","size":38},{"path":"src/follow_the_money/feed/bundle.py","sha256":"849055526f296f7227e8010a1cac9b1ba97038a70a4425d55bc46b3c1dd27314","size":22970},{"path":"src/follow_the_money/feed/checkpoint.py","sha256":"4a1aaaf6f4752dbf6a4fdb17d88e30dc962370f2163264d300c7b91c411c0b1d","size":3966},{"path":"src/follow_the_money/feed/cli.py","sha256":"b7b72e073335d8dcef8d053929243ea7ac4b1334bc10772c3c5dcf83c998f685","size":60346},{"path":"src/follow_the_money/feed/dedupe.py","sha256":"f0bf6b8c0fbe902a19f961d37951d4e192567d0f15af70769a2c539237f57394","size":6977},{"path":"src/follow_the_money/feed/deployment.py","sha256":"561f10e2b52d1be55dbf1f95a129c7fea2a4719f9deb1c10f07a43286ab3a394","size":46871},{"path":"src/follow_the_money/feed/freshness.py","sha256":"88d68bce1505d39dfc1bb5ec4650b283cb138df0860884ca69f644d2f65c2c43","size":5425},{"path":"src/follow_the_money/feed/plan.py","sha256":"3448102ac330e5992ca9470b10ddf3ba20deef2e4e87afbfa633964d6b49bd39","size":13264},{"path":"src/follow_the_money/feed/publish.py","sha256":"6a156c7bd6480caa14d64bea0315b77f42246dc53e3aa7a33f8e2134c9ab2c19","size":13190},{"path":"src/follow_the_money/feed/remote.py","sha256":"2b6a23664e2d6ab6ba744a4b47eae6e63e512a53a4e7bc17c21554e1d9ea0188","size":5250},{"path":"src/follow_the_money/feed/snapshot.py","sha256":"4ac126ae1c6462c8f31108ba8b1ba783d9b7ad767f821f44401bc68bea70e7ce","size":12325},{"path":"src/follow_the_money/feed/validate.py","sha256":"0925b22bd7a7a428ba3f63587704425e165ca3dd5d02f34e43e9c90cb4de2ff9","size":124115},{"path":"src/follow_the_money/providers/__init__.py","sha256":"e45f189690b1c38b783f0c2eccb7d60f136cda9be2437f706f745295c5c94f4e","size":32},{"path":"src/follow_the_money/providers/adapters.py","sha256":"3f58abf511698f8ae63a7a62510c6a332b131c9d4c2dce795b4fdca0c9d6ad24","size":83604},{"path":"src/follow_the_money/providers/base.py","sha256":"2abe6919b427ef0710a48a4c60018467e3dedc5acecebe1c2280c34714172734","size":1660},{"path":"src/follow_the_money/providers/cftc_cot.py","sha256":"94d7646d532ac59ec2cfa3bb79816936bf6ee48a47896ac21ecced17e82db63a","size":12471},{"path":"src/follow_the_money/providers/document.py","sha256":"2e5f09165c39a45543d19486d4b17bd61299c66f4dc9a08985249b9beca2feb8","size":13463},{"path":"src/follow_the_money/providers/http.py","sha256":"a6feaaef22cf33b84458fa298c4737191618e49fee9a641b985e82beb1e5f358","size":8586},{"path":"src/follow_the_money/providers/lock.py","sha256":"04441c1eec98a64a09a34a9971c45ef08383e719a156819e8e80ca130b2305a5","size":2979},{"path":"src/follow_the_money/providers/manifest.py","sha256":"5ffe0c22a76cfbcbb7017bd069322c44949cf3c0247d27928af65f40eeed2121","size":45706},{"path":"src/follow_the_money/providers/rate.py","sha256":"f88d56b878cbf460bac1218cda4e59bd74004b1c186c944492f2a28c5fea1881","size":18340},{"path":"src/follow_the_money/providers/sec_13f.py","sha256":"1c9d6dd23cf41ab624fb8a996791f2e926a23112d6a17311668a81a89492a290","size":19808},{"path":"src/follow_the_money/providers/sec_beneficial_ownership.py","sha256":"a33dc0818cac80603bee61c0191d79ff9b015dc68d6a82a144b23b49a5d7ab99","size":57351},{"path":"src/follow_the_money/providers/sec_form4.py","sha256":"7a22647d1b72f1ee071b742441de30e2c35253fe6f88edc6a0fe0c3135b7bce0","size":39734},{"path":"src/follow_the_money/providers/session.py","sha256":"c7dfb3506c8cc5bc27b7deec56a1dc33198f19784089caf2bfdb425a9de3ae00","size":14670},{"path":"src/follow_the_money/providers/urls.py","sha256":"1a6c08faca846f26b3c965e9bc96c7e25ac56e4f886b89acf52089fea73e8473","size":7821},{"path":"src/follow_the_money/schema.py","sha256":"41e423aa467756df4eea9a7cd200bc358594255d8bffe42e5227f3a4f8468250","size":3226},{"path":"src/follow_the_money/semantic/__init__.py","sha256":"885261ad48125c1ac320c39d879a8ab8223343b4ddca470075683cba162ca373","size":854},{"path":"src/follow_the_money/semantic/context.py","sha256":"ba74acdba4535e08e60b2745bc45b420be35e346888bc9d4b05a7336b763d016","size":15877},{"path":"src/follow_the_money/semantic/facts.py","sha256":"39daebcd144